set_id,icd_code,icd_description,snomed,snomed_concept_name
476,T82.84,"Pain due to cardiac and vascular prosthetic devices, implants and grafts",22253000,Pain (finding)
476,T82.82,"Fibrosis due to cardiac and vascular prosthetic devices, implants and grafts",22253000,Pain (finding)
477,M79.67,Pain in foot and toes,22253000,Pain (finding)
477,Q74.2,"Other congenital malformations of lower limb(s), including pelvic girdle",22253000,Pain (finding)
478,H65.19,Other acute nonsuppurative otitis media,65363002,Otitis media (disorder)
479,H65.93,"Unspecified nonsuppurative otitis media, bilateral",65363002,Otitis media (disorder)
480,H65.91,"Unspecified nonsuppurative otitis media, right ear",65363002,Otitis media (disorder)
481,H65.92,"Unspecified nonsuppurative otitis media, left ear",65363002,Otitis media (disorder)
482,A38.0,Scarlet fever with otitis media,65363002,Otitis media (disorder)
483,H66.9,"Otitis media, unspecified",65363002,Otitis media (disorder)
484,H67,Otitis media in diseases classified elsewhere,65363002,Otitis media (disorder)
485,H66.92,"Otitis media, unspecified, left ear",65363002,Otitis media (disorder)
486,H65.90,"Unspecified nonsuppurative otitis media, unspecified ear",65363002,Otitis media (disorder)
487,H66.93,"Otitis media, unspecified, bilateral",65363002,Otitis media (disorder)
488,H66.91,"Otitis media, unspecified, right ear",65363002,Otitis media (disorder)
489,H66.90,"Otitis media, unspecified, unspecified ear",65363002,Otitis media (disorder)
490,Z86.69,Personal history of other diseases of the nervous system and sense organs,65363002,Otitis media (disorder)
490,Z09,Encounter for follow-up examination after completed treatment for conditions other than malignant neoplasm,65363002,Otitis media (disorder)
491,R06.00,"Dyspnea, unspecified",267036007,Dyspnea (finding)
492,R06.02,Shortness of breath,267036007,Dyspnea (finding)
493,I50.9,"Heart failure, unspecified",267036007,Dyspnea (finding)
494,R06.81,"Apnea, not elsewhere classified",267036007,Dyspnea (finding)
495,T70.29,Other effects of high altitude,267036007,Dyspnea (finding)
496,R06.0,Dyspnea,267036007,Dyspnea (finding)
497,R06.09,Other forms of dyspnea,267036007,Dyspnea (finding)
498,M54.5,Low back pain,278860009,Chronic low back pain (finding)
499,M54.40,"Lumbago with sciatica, unspecified side",278860009,Chronic low back pain (finding)
499,G89.29,Other chronic pain,278860009,Chronic low back pain (finding)
500,M54.41,"Lumbago with sciatica, right side",278860009,Chronic low back pain (finding)
500,G89.29,Other chronic pain,278860009,Chronic low back pain (finding)
501,M54.42,"Lumbago with sciatica, left side",278860009,Chronic low back pain (finding)
501,G89.29,Other chronic pain,278860009,Chronic low back pain (finding)
502,N18.30,"Chronic kidney disease, stage 3 unspecified",433144002,Chronic kidney disease stage 3 (disorder)
503,N18.4,"Chronic kidney disease, stage 4 (severe)",433144002,Chronic kidney disease stage 3 (disorder)
504,N18.31,"Chronic kidney disease, stage 3a",433144002,Chronic kidney disease stage 3 (disorder)
505,N18.32,"Chronic kidney disease, stage 3b",433144002,Chronic kidney disease stage 3 (disorder)
506,N18.3,"Chronic kidney disease, stage 3 (moderate)",433144002,Chronic kidney disease stage 3 (disorder)
507,S32.00,Fracture of unspecified lumbar vertebra,15724005,Fracture of vertebral column without spinal cord injury (disorder)
508,C34.82,Malignant neoplasm of overlapping sites of left bronchus and lung,254632001,Small cell carcinoma of lung (disorder)
509,C34.81,Malignant neoplasm of overlapping sites of right bronchus and lung,254632001,Small cell carcinoma of lung (disorder)
510,C34.10,"Malignant neoplasm of upper lobe, unspecified bronchus or lung",254632001,Small cell carcinoma of lung (disorder)
511,C34.30,"Malignant neoplasm of lower lobe, unspecified bronchus or lung",254632001,Small cell carcinoma of lung (disorder)
512,C34.31,"Malignant neoplasm of lower lobe, right bronchus or lung",254632001,Small cell carcinoma of lung (disorder)
513,C34.2,"Malignant neoplasm of middle lobe, bronchus or lung",254632001,Small cell carcinoma of lung (disorder)
514,C34.11,"Malignant neoplasm of upper lobe, right bronchus or lung",254632001,Small cell carcinoma of lung (disorder)
515,C34.32,"Malignant neoplasm of lower lobe, left bronchus or lung",254632001,Small cell carcinoma of lung (disorder)
516,C34.00,Malignant neoplasm of unspecified main bronchus,254632001,Small cell carcinoma of lung (disorder)
517,C34.01,Malignant neoplasm of right main bronchus,254632001,Small cell carcinoma of lung (disorder)
518,C34.12,"Malignant neoplasm of upper lobe, left bronchus or lung",254632001,Small cell carcinoma of lung (disorder)
519,C34.02,Malignant neoplasm of left main bronchus,254632001,Small cell carcinoma of lung (disorder)
520,C34.92,Malignant neoplasm of unspecified part of left bronchus or lung,254632001,Small cell carcinoma of lung (disorder)
521,C34.91,Malignant neoplasm of unspecified part of right bronchus or lung,254632001,Small cell carcinoma of lung (disorder)
522,C34.90,Malignant neoplasm of unspecified part of unspecified bronchus or lung,254632001,Small cell carcinoma of lung (disorder)
523,S93.40,Sprain of unspecified ligament of ankle,44465007,Sprain of ankle (disorder)
524,S93.49,Sprain of other ligament of ankle,44465007,Sprain of ankle (disorder)
525,S96.91,Strain of unspecified muscle and tendon at ankle and foot level,44465007,Sprain of ankle (disorder)
526,S93.42,Sprain of deltoid ligament,44465007,Sprain of ankle (disorder)
527,S93.4,Sprain of ankle,44465007,Sprain of ankle (disorder)
528,S24.10,Unspecified injury of thoracic spinal cord,1734006,Fracture of vertebral column with spinal cord injury (disorder)
529,S14.10,Unspecified injury of cervical spinal cord,1734006,Fracture of vertebral column with spinal cord injury (disorder)
529,S12.50,Unspecified fracture of sixth cervical vertebra,1734006,Fracture of vertebral column with spinal cord injury (disorder)
530,S34.13,Other and unspecified injury to sacral spinal cord,1734006,Fracture of vertebral column with spinal cord injury (disorder)
530,S32.2,Fracture of coccyx,1734006,Fracture of vertebral column with spinal cord injury (disorder)
531,S34.10,Unspecified injury to lumbar spinal cord,1734006,Fracture of vertebral column with spinal cord injury (disorder)
531,S32.00,Fracture of unspecified lumbar vertebra,1734006,Fracture of vertebral column with spinal cord injury (disorder)
532,F32,"Major depressive disorder, single episode",36923009,"Major depression, single episode (disorder)"
533,G24,Dystonia,15802004,Dystonia (disorder)
534,R25.8,Other abnormal involuntary movements,15802004,Dystonia (disorder)
535,F43.1,Post-traumatic stress disorder (PTSD),47505003,Posttraumatic stress disorder (disorder)
536,F43.11,"Post-traumatic stress disorder, acute",47505003,Posttraumatic stress disorder (disorder)
537,F43.12,"Post-traumatic stress disorder, chronic",47505003,Posttraumatic stress disorder (disorder)
538,F48.8,Other specified nonpsychotic mental disorders,47505003,Posttraumatic stress disorder (disorder)
539,F43.10,"Post-traumatic stress disorder, unspecified",47505003,Posttraumatic stress disorder (disorder)
540,F43.9,"Reaction to severe stress, unspecified",47505003,Posttraumatic stress disorder (disorder)
541,K11.7,Disturbances of salivary secretion,62718007,Dribbling from mouth (finding)
542,T65.81,Toxic effect of latex,300916003,Allergy to latex (finding)
543,Z91.04,Nonmedicinal substance allergy status,300916003,Allergy to latex (finding)
544,Q76.3,Congenital scoliosis due to congenital bony malformation,298382003,Scoliosis deformity of spine (disorder)
545,M41,Scoliosis,298382003,Scoliosis deformity of spine (disorder)
546,M96.5,Postradiation scoliosis,298382003,Scoliosis deformity of spine (disorder)
547,Q67.5,Congenital deformity of spine,298382003,Scoliosis deformity of spine (disorder)
547,Q66.89,Other specified congenital deformities of feet,298382003,Scoliosis deformity of spine (disorder)
548,S09.90,Unspecified injury of head,25064002,Headache (finding)
549,G44.84,Primary exertional headache,25064002,Headache (finding)
550,G44.30,"Post-traumatic headache, unspecified",25064002,Headache (finding)
551,G43.80,"Other migraine, not intractable",25064002,Headache (finding)
552,G44.4,"Drug-induced headache, not elsewhere classified",25064002,Headache (finding)
553,G51.8,Other disorders of facial nerve,25064002,Headache (finding)
554,G44.89,Other headache syndrome,25064002,Headache (finding)
555,R51,Headache,25064002,Headache (finding)
556,G44.40,"Drug-induced headache, not elsewhere classified, not intractable",25064002,Headache (finding)
557,G44.41,"Drug-induced headache, not elsewhere classified, intractable",25064002,Headache (finding)
558,R39.19,Other difficulties with micturition,267064002,Retention of urine (disorder)
559,N40.1,Benign prostatic hyperplasia with lower urinary tract symptoms,267064002,Retention of urine (disorder)
560,R33,Retention of urine,267064002,Retention of urine (disorder)
561,J96.20,"Acute and chronic respiratory failure, unspecified whether with hypoxia or hypercapnia",65710008,Acute respiratory failure (disorder)
562,J95.88,"Other intraoperative complications of respiratory system, not elsewhere classified",65710008,Acute respiratory failure (disorder)
563,J96.0,Acute respiratory failure,65710008,Acute respiratory failure (disorder)
564,J95.82,Postprocedural respiratory failure,65710008,Acute respiratory failure (disorder)
565,J96.01,Acute respiratory failure with hypoxia,65710008,Acute respiratory failure (disorder)
566,J96.00,"Acute respiratory failure, unspecified whether with hypoxia or hypercapnia",65710008,Acute respiratory failure (disorder)
567,J96.90,"Respiratory failure, unspecified, unspecified whether with hypoxia or hypercapnia",65710008,Acute respiratory failure (disorder)
567,G70.9,"Myoneural disorder, unspecified",65710008,Acute respiratory failure (disorder)
568,J96.90,"Respiratory failure, unspecified, unspecified whether with hypoxia or hypercapnia",65710008,Acute respiratory failure (disorder)
568,A41.3,Sepsis due to Hemophilus influenzae,65710008,Acute respiratory failure (disorder)
568,R65.21,Severe sepsis with septic shock,65710008,Acute respiratory failure (disorder)
569,K63.5,Polyp of colon,68496003,Polyp of colon (disorder)
570,K51.41,Inflammatory polyps of colon with complications,68496003,Polyp of colon (disorder)
571,K51.40,Inflammatory polyps of colon without complications,68496003,Polyp of colon (disorder)
572,S98.91,"Complete traumatic amputation of foot, level unspecified",429280009,History of amputation of foot (situation)
573,Z89.44,Acquired absence of ankle,429280009,History of amputation of foot (situation)
574,Z89.43,Acquired absence of foot,429280009,History of amputation of foot (situation)
575,Z89.42,Acquired absence of other toe(s),429280009,History of amputation of foot (situation)
576,Q67.5,Congenital deformity of spine,76916001,Spina bifida occulta (disorder)
577,Q76.0,Spina bifida occulta,76916001,Spina bifida occulta (disorder)
578,R68.83,Chills (without fever),43724002,Chill (finding)
579,E78.1,Pure hyperglyceridemia,55822004,Hyperlipidemia (disorder)
580,E78.3,Hyperchylomicronemia,55822004,Hyperlipidemia (disorder)
581,E78.5,"Hyperlipidemia, unspecified",55822004,Hyperlipidemia (disorder)
582,E78.4,Other hyperlipidemia,55822004,Hyperlipidemia (disorder)
583,E78.49,Other hyperlipidemia,55822004,Hyperlipidemia (disorder)
584,R79.89,Other specified abnormal findings of blood chemistry,55822004,Hyperlipidemia (disorder)
585,N12,"Tubulo-interstitial nephritis, not specified as acute or chronic",68566005,Urinary tract infectious disease (disorder)
586,Z87.44,Personal history of diseases of urinary system,68566005,Urinary tract infectious disease (disorder)
587,N39.0,"Urinary tract infection, site not specified",68566005,Urinary tract infectious disease (disorder)
588,O99.82,"Streptococcus B carrier state complicating pregnancy, childbirth and the puerperium",68566005,Urinary tract infectious disease (disorder)
589,O03.88,Urinary tract infection following complete or unspecified spontaneous abortion,68566005,Urinary tract infectious disease (disorder)
590,N99.52,Complication of incontinent external stoma of urinary tract,68566005,Urinary tract infectious disease (disorder)
591,J02.9,"Acute pharyngitis, unspecified",267102003,Sore throat symptom (finding)
592,M79.11,Myalgia of mastication muscle,68962001,Muscle pain (finding)
593,M79.1,Myalgia,68962001,Muscle pain (finding)
594,M79.12,"Myalgia of auxiliary muscles, head and neck",68962001,Muscle pain (finding)
595,M79.7,Fibromyalgia,68962001,Muscle pain (finding)
596,M54.2,Cervicalgia,68962001,Muscle pain (finding)
597,T14.8,Other injury of unspecified body region,68962001,Muscle pain (finding)
598,M79.18,"Myalgia, other site",68962001,Muscle pain (finding)
599,M79.10,"Myalgia, unspecified site",68962001,Muscle pain (finding)
600,L89,Pressure ulcer,399912005,Pressure ulcer (disorder)
601,L98.49,Non-pressure chronic ulcer of skin of other sites,399912005,Pressure ulcer (disorder)
602,S88.11,Complete traumatic amputation at level between knee and ankle,161622006,History of lower limb amputation (situation)
603,Z89.61,Acquired absence of leg above knee,161622006,History of lower limb amputation (situation)
604,Q87.89,"Other specified congenital malformation syndromes, not elsewhere classified",230745008,Hydrocephalus (disorder)
605,Q05.3,Sacral spina bifida with hydrocephalus,230745008,Hydrocephalus (disorder)
606,Q05.1,Thoracic spina bifida with hydrocephalus,230745008,Hydrocephalus (disorder)
607,Q05.0,Cervical spina bifida with hydrocephalus,230745008,Hydrocephalus (disorder)
608,Q05.2,Lumbar spina bifida with hydrocephalus,230745008,Hydrocephalus (disorder)
609,G91,Hydrocephalus,230745008,Hydrocephalus (disorder)
610,Q03.9,"Congenital hydrocephalus, unspecified",230745008,Hydrocephalus (disorder)
611,A17.89,Other tuberculosis of nervous system,230745008,Hydrocephalus (disorder)
612,E84,Cystic fibrosis,190905008,Cystic fibrosis (disorder)
613,I97.81,Intraoperative cerebrovascular infarction,230690007,Cerebrovascular accident (disorder)
614,I69.39,Other sequelae of cerebral infarction,230690007,Cerebrovascular accident (disorder)
615,I63.53,Cerebral infarction due to unspecified occlusion or stenosis of posterior cerebral artery,230690007,Cerebrovascular accident (disorder)
616,I63.51,Cerebral infarction due to unspecified occlusion or stenosis of middle cerebral artery,230690007,Cerebrovascular accident (disorder)
617,I63.52,Cerebral infarction due to unspecified occlusion or stenosis of anterior cerebral artery,230690007,Cerebrovascular accident (disorder)
618,I63.29,Cerebral infarction due to unspecified occlusion or stenosis of other precerebral arteries,230690007,Cerebrovascular accident (disorder)
619,I63.89,Other cerebral infarction,230690007,Cerebrovascular accident (disorder)
620,I63.59,Cerebral infarction due to unspecified occlusion or stenosis of other cerebral artery,230690007,Cerebrovascular accident (disorder)
621,Z78.9,Other specified health status,230690007,Cerebrovascular accident (disorder)
622,I63.54,Cerebral infarction due to unspecified occlusion or stenosis of cerebellar artery,230690007,Cerebrovascular accident (disorder)
623,I63.21,Cerebral infarction due to unspecified occlusion or stenosis of vertebral arteries,230690007,Cerebrovascular accident (disorder)
624,Z86.73,"Personal history of transient ischemic attack (TIA), and cerebral infarction without residual deficits",230690007,Cerebrovascular accident (disorder)
625,I60.7,Nontraumatic subarachnoid hemorrhage from unspecified intracranial artery,230690007,Cerebrovascular accident (disorder)
626,I63.23,Cerebral infarction due to unspecified occlusion or stenosis of carotid arteries,230690007,Cerebrovascular accident (disorder)
627,I63.6,"Cerebral infarction due to cerebral venous thrombosis, nonpyogenic",230690007,Cerebrovascular accident (disorder)
628,I63.22,Cerebral infarction due to unspecified occlusion or stenosis of basilar artery,230690007,Cerebrovascular accident (disorder)
629,I63.20,Cerebral infarction due to unspecified occlusion or stenosis of unspecified precerebral arteries,230690007,Cerebrovascular accident (disorder)
630,I60.9,"Nontraumatic subarachnoid hemorrhage, unspecified",230690007,Cerebrovascular accident (disorder)
631,I69.34,Monoplegia of lower limb following cerebral infarction,230690007,Cerebrovascular accident (disorder)
632,I69.33,Monoplegia of upper limb following cerebral infarction,230690007,Cerebrovascular accident (disorder)
633,I69.31,Cognitive deficits following cerebral infarction,230690007,Cerebrovascular accident (disorder)
634,I69.30,Unspecified sequelae of cerebral infarction,230690007,Cerebrovascular accident (disorder)
635,I61.9,"Nontraumatic intracerebral hemorrhage, unspecified",230690007,Cerebrovascular accident (disorder)
636,I63.50,Cerebral infarction due to unspecified occlusion or stenosis of unspecified cerebral artery,230690007,Cerebrovascular accident (disorder)
637,I69.32,Speech and language deficits following cerebral infarction,230690007,Cerebrovascular accident (disorder)
638,I69.35,Hemiplegia and hemiparesis following cerebral infarction,230690007,Cerebrovascular accident (disorder)
639,I63.9,"Cerebral infarction, unspecified",230690007,Cerebrovascular accident (disorder)
640,I63.81,Other cerebral infarction due to occlusion or stenosis of small artery,230690007,Cerebrovascular accident (disorder)
641,M05.69,Rheumatoid arthritis of multiple sites with involvement of other organs and systems,69896004,Rheumatoid arthritis (disorder)
642,M65.83,"Other synovitis and tenosynovitis, forearm",69896004,Rheumatoid arthritis (disorder)
643,M05.60,Rheumatoid arthritis of unspecified site with involvement of other organs and systems,69896004,Rheumatoid arthritis (disorder)
644,M05.30,Rheumatoid heart disease with rheumatoid arthritis of unspecified site,69896004,Rheumatoid arthritis (disorder)
645,M05.80,Other rheumatoid arthritis with rheumatoid factor of unspecified site,69896004,Rheumatoid arthritis (disorder)
646,M05.70,Rheumatoid arthritis with rheumatoid factor of unspecified site without organ or systems involvement,69896004,Rheumatoid arthritis (disorder)
647,M05.50,Rheumatoid polyneuropathy with rheumatoid arthritis of unspecified site,69896004,Rheumatoid arthritis (disorder)
648,M05.6,Rheumatoid arthritis with involvement of other organs and systems,69896004,Rheumatoid arthritis (disorder)
649,M06,Other rheumatoid arthritis,69896004,Rheumatoid arthritis (disorder)
650,M05.12,Rheumatoid lung disease with rheumatoid arthritis of elbow,69896004,Rheumatoid arthritis (disorder)
651,M05.8,Other rheumatoid arthritis with rheumatoid factor,69896004,Rheumatoid arthritis (disorder)
652,M05.16,Rheumatoid lung disease with rheumatoid arthritis of knee,69896004,Rheumatoid arthritis (disorder)
653,M05.7,Rheumatoid arthritis with rheumatoid factor without organ or systems involvement,69896004,Rheumatoid arthritis (disorder)
654,M45.9,Ankylosing spondylitis of unspecified sites in spine,69896004,Rheumatoid arthritis (disorder)
655,M79.0,"Rheumatism, unspecified",69896004,Rheumatoid arthritis (disorder)
655,R23.9,Unspecified skin changes,69896004,Rheumatoid arthritis (disorder)
656,M05.10,Rheumatoid lung disease with rheumatoid arthritis of unspecified site,69896004,Rheumatoid arthritis (disorder)
656,M05.20,Rheumatoid vasculitis with rheumatoid arthritis of unspecified site,69896004,Rheumatoid arthritis (disorder)
657,G89.29,Other chronic pain,82423001,Chronic pain (finding)
658,M25.56,Pain in knee,82423001,Chronic pain (finding)
659,S39.01,"Strain of muscle, fascia and tendon of abdomen, lower back and pelvis",82423001,Chronic pain (finding)
660,G89.3,Neoplasm related pain (acute) (chronic),82423001,Chronic pain (finding)
661,G89.4,Chronic pain syndrome,82423001,Chronic pain (finding)
662,S58.01,Complete traumatic amputation at elbow level,161621004,History of upper limb amputation (situation)
663,Z89.20,"Acquired absence of upper limb, unspecified level",161621004,History of upper limb amputation (situation)
664,S48.91,"Complete traumatic amputation of shoulder and upper arm, level unspecified",161621004,History of upper limb amputation (situation)
665,S58.11,Complete traumatic amputation at level between elbow and wrist,161621004,History of upper limb amputation (situation)
666,T87.50,"Necrosis of amputation stump, unspecified extremity",161621004,History of upper limb amputation (situation)
667,T87.30,"Neuroma of amputation stump, unspecified extremity",161621004,History of upper limb amputation (situation)
668,Z89.22,Acquired absence of upper limb above elbow,161621004,History of upper limb amputation (situation)
669,S48.11,Complete traumatic amputation at level between shoulder and elbow,161621004,History of upper limb amputation (situation)
670,Z89.9,"Acquired absence of limb, unspecified",161621004,History of upper limb amputation (situation)
671,Z89.11,Acquired absence of hand,161621004,History of upper limb amputation (situation)
672,Z89.23,Acquired absence of shoulder,161621004,History of upper limb amputation (situation)
673,Z89.21,Acquired absence of upper limb below elbow,161621004,History of upper limb amputation (situation)
674,J45.90,Unspecified asthma,10509002,Acute bronchitis (disorder)
675,J45.21,Mild intermittent asthma with (acute) exacerbation,10509002,Acute bronchitis (disorder)
676,J20,Acute bronchitis,10509002,Acute bronchitis (disorder)
677,J44.0,Chronic obstructive pulmonary disease with (acute) lower respiratory infection,10509002,Acute bronchitis (disorder)
678,J20.8,Acute bronchitis due to other specified organisms,10509002,Acute bronchitis (disorder)
678,B97.81,Human metapneumovirus as the cause of diseases classified elsewhere,10509002,Acute bronchitis (disorder)
679,K21,Gastro-esophageal reflux disease,235595009,Gastroesophageal reflux disease (disorder)
680,P78.83,Newborn esophageal reflux,235595009,Gastroesophageal reflux disease (disorder)
681,K81.0,Acute cholecystitis,65275009,Acute cholecystitis (disorder)
682,K80.63,Calculus of gallbladder and bile duct with acute cholecystitis with obstruction,65275009,Acute cholecystitis (disorder)
683,K80.62,Calculus of gallbladder and bile duct with acute cholecystitis without obstruction,65275009,Acute cholecystitis (disorder)
684,K91.86,Retained cholelithiasis following cholecystectomy,235919008,Gallbladder calculus (disorder)
685,K80.81,Other cholelithiasis with obstruction,235919008,Gallbladder calculus (disorder)
686,K80.2,Calculus of gallbladder without cholecystitis,235919008,Gallbladder calculus (disorder)
687,K80.70,Calculus of gallbladder and bile duct without cholecystitis without obstruction,235919008,Gallbladder calculus (disorder)
688,K80.20,Calculus of gallbladder without cholecystitis without obstruction,235919008,Gallbladder calculus (disorder)
689,D72.82,Elevated white blood cell count,386661006,Fever (finding)
690,P81.9,"Disturbance of temperature regulation of newborn, unspecified",386661006,Fever (finding)
691,M04.1,Periodic fever syndromes,386661006,Fever (finding)
692,R50.9,"Fever, unspecified",386661006,Fever (finding)
693,R50.81,Fever presenting with conditions classified elsewhere,386661006,Fever (finding)
694,R50.8,Other specified fever,386661006,Fever (finding)
695,B09,Unspecified viral infection characterized by skin and mucous membrane lesions,386661006,Fever (finding)
696,R50.2,Drug induced fever,386661006,Fever (finding)
696,T49.0,"Poisoning by, adverse effect of and underdosing of local antifungal, anti-infective and anti-inflammatory drugs",386661006,Fever (finding)
697,R10.9,Unspecified abdominal pain,386661006,Fever (finding)
697,G89.18,Other acute postprocedural pain,386661006,Fever (finding)
697,R50.82,Postprocedural fever,386661006,Fever (finding)
698,G11.4,Hereditary spastic paraplegia,221360009,Spasticity (finding)
699,M62.40,"Contracture of muscle, unspecified site",221360009,Spasticity (finding)
700,R25.2,Cramp and spasm,221360009,Spasticity (finding)
701,M62.83,Muscle spasm,221360009,Spasticity (finding)
702,I61.9,"Nontraumatic intracerebral hemorrhage, unspecified",221360009,Spasticity (finding)
702,G81.12,Spastic hemiplegia affecting left dominant side,221360009,Spasticity (finding)
703,G81.14,Spastic hemiplegia affecting left nondominant side,221360009,Spasticity (finding)
703,I61.9,"Nontraumatic intracerebral hemorrhage, unspecified",221360009,Spasticity (finding)
704,G81.13,Spastic hemiplegia affecting right nondominant side,221360009,Spasticity (finding)
704,I61.9,"Nontraumatic intracerebral hemorrhage, unspecified",221360009,Spasticity (finding)
705,I60.9,"Nontraumatic subarachnoid hemorrhage, unspecified",221360009,Spasticity (finding)
705,G81.11,Spastic hemiplegia affecting right dominant side,221360009,Spasticity (finding)
706,I60.9,"Nontraumatic subarachnoid hemorrhage, unspecified",221360009,Spasticity (finding)
706,G81.14,Spastic hemiplegia affecting left nondominant side,221360009,Spasticity (finding)
707,I60.9,"Nontraumatic subarachnoid hemorrhage, unspecified",221360009,Spasticity (finding)
707,G81.12,Spastic hemiplegia affecting left dominant side,221360009,Spasticity (finding)
708,G81.11,Spastic hemiplegia affecting right dominant side,221360009,Spasticity (finding)
708,I67.89,Other cerebrovascular disease,221360009,Spasticity (finding)
709,G81.14,Spastic hemiplegia affecting left nondominant side,221360009,Spasticity (finding)
709,I67.89,Other cerebrovascular disease,221360009,Spasticity (finding)
710,I67.89,Other cerebrovascular disease,221360009,Spasticity (finding)
710,G81.12,Spastic hemiplegia affecting left dominant side,221360009,Spasticity (finding)
711,G81.11,Spastic hemiplegia affecting right dominant side,221360009,Spasticity (finding)
711,I61.9,"Nontraumatic intracerebral hemorrhage, unspecified",221360009,Spasticity (finding)
