set_id,icd_code,icd_description,snomed,snomed_concept_name
712,I60.9,"Nontraumatic subarachnoid hemorrhage, unspecified",221360009,Spasticity (finding)
712,G81.13,Spastic hemiplegia affecting right nondominant side,221360009,Spasticity (finding)
713,G81.13,Spastic hemiplegia affecting right nondominant side,221360009,Spasticity (finding)
713,I67.89,Other cerebrovascular disease,221360009,Spasticity (finding)
714,D01.0,Carcinoma in situ of colon,93761005,Primary malignant neoplasm of colon (disorder)
715,C49.A4,Gastrointestinal stromal tumor of large intestine,93761005,Primary malignant neoplasm of colon (disorder)
716,C18.9,"Malignant neoplasm of colon, unspecified",93761005,Primary malignant neoplasm of colon (disorder)
717,C18.8,Malignant neoplasm of overlapping sites of colon,93761005,Primary malignant neoplasm of colon (disorder)
717,C77.2,Secondary and unspecified malignant neoplasm of intra-abdominal lymph nodes,93761005,Primary malignant neoplasm of colon (disorder)
718,J98.01,Acute bronchospasm,49727002,Cough (finding)
719,J06.9,"Acute upper respiratory infection, unspecified",49727002,Cough (finding)
720,R05,Cough,49727002,Cough (finding)
721,B08.8,Other specified viral infections characterized by skin and mucous membrane lesions,195662009,Acute viral pharyngitis (disorder)
722,B08.5,Enteroviral vesicular pharyngitis,195662009,Acute viral pharyngitis (disorder)
723,J02.9,"Acute pharyngitis, unspecified",195662009,Acute viral pharyngitis (disorder)
724,M79.7,Fibromyalgia,95417003,Primary fibromyalgia syndrome (disorder)
725,S63.59,Other specified sprain of wrist,70704007,Sprain of wrist (disorder)
726,S63.50,Unspecified sprain of wrist,70704007,Sprain of wrist (disorder)
727,S69.91,"Unspecified injury of right wrist, hand and finger(s)",70704007,Sprain of wrist (disorder)
728,S69.92,"Unspecified injury of left wrist, hand and finger(s)",70704007,Sprain of wrist (disorder)
729,S69.90,"Unspecified injury of unspecified wrist, hand and finger(s)",70704007,Sprain of wrist (disorder)
730,I82.42,Acute embolism and thrombosis of iliac vein,132281000119108,Acute deep venous thrombosis (disorder)
731,I82.40,Acute embolism and thrombosis of unspecified deep veins of lower extremity,132281000119108,Acute deep venous thrombosis (disorder)
732,I82.C13,"Acute embolism and thrombosis of internal jugular vein, bilateral",132281000119108,Acute deep venous thrombosis (disorder)
733,I82.90,Acute embolism and thrombosis of unspecified vein,132281000119108,Acute deep venous thrombosis (disorder)
734,I82.B13,"Acute embolism and thrombosis of subclavian vein, bilateral",132281000119108,Acute deep venous thrombosis (disorder)
735,I82.B19,Acute embolism and thrombosis of unspecified subclavian vein,132281000119108,Acute deep venous thrombosis (disorder)
736,I82.B11,Acute embolism and thrombosis of right subclavian vein,132281000119108,Acute deep venous thrombosis (disorder)
737,I82.B12,Acute embolism and thrombosis of left subclavian vein,132281000119108,Acute deep venous thrombosis (disorder)
738,I82.C11,Acute embolism and thrombosis of right internal jugular vein,132281000119108,Acute deep venous thrombosis (disorder)
739,I82.C12,Acute embolism and thrombosis of left internal jugular vein,132281000119108,Acute deep venous thrombosis (disorder)
740,I82.C19,Acute embolism and thrombosis of unspecified internal jugular vein,132281000119108,Acute deep venous thrombosis (disorder)
741,S13.4,Sprain of ligaments of cervical spine,39848009,Whiplash injury to neck (disorder)
742,I26.90,Septic pulmonary embolism without acute cor pulmonale,706870000,Acute pulmonary embolism (disorder)
743,I26.99,Other pulmonary embolism without acute cor pulmonale,706870000,Acute pulmonary embolism (disorder)
744,I26.09,Other pulmonary embolism with acute cor pulmonale,706870000,Acute pulmonary embolism (disorder)
745,I26.92,Saddle embolus of pulmonary artery without acute cor pulmonale,706870000,Acute pulmonary embolism (disorder)
746,I26.02,Saddle embolus of pulmonary artery with acute cor pulmonale,706870000,Acute pulmonary embolism (disorder)
747,I26.01,Septic pulmonary embolism with acute cor pulmonale,706870000,Acute pulmonary embolism (disorder)
748,G43.71,"Chronic migraine without aura, intractable",124171000119105,Chronic intractable migraine without aura (disorder)
749,G43.70,"Chronic migraine without aura, not intractable",124171000119105,Chronic intractable migraine without aura (disorder)
750,K36,Other appendicitis,74400008,Appendicitis (disorder)
751,K35.89,Other acute appendicitis,74400008,Appendicitis (disorder)
752,K35.33,"Acute appendicitis with perforation and localized peritonitis, with abscess",74400008,Appendicitis (disorder)
753,K37,Unspecified appendicitis,74400008,Appendicitis (disorder)
754,A42.1,Abdominal actinomycosis,74400008,Appendicitis (disorder)
755,Z90.49,Acquired absence of other specified parts of digestive tract,428251008,History of appendectomy (situation)
756,Z09,Encounter for follow-up examination after completed treatment for conditions other than malignant neoplasm,428251008,History of appendectomy (situation)
757,K01.1,Impacted teeth,196416002,Impacted molars (disorder)
758,O03.86,Cardiac arrest following complete or unspecified spontaneous abortion,410429000,Cardiac arrest (disorder)
759,I97.12,Postprocedural cardiac arrest,410429000,Cardiac arrest (disorder)
760,I97.71,Intraoperative cardiac arrest,410429000,Cardiac arrest (disorder)
761,I46,Cardiac arrest,410429000,Cardiac arrest (disorder)
762,O08.81,Cardiac arrest following an ectopic and molar pregnancy,410429000,Cardiac arrest (disorder)
763,O29.11,Cardiac arrest due to anesthesia during pregnancy,410429000,Cardiac arrest (disorder)
764,O07.36,Cardiac arrest following failed attempted termination of pregnancy,410429000,Cardiac arrest (disorder)
765,K62.5,Hemorrhage of anus and rectum,6072007,Bleeding from anus (disorder)
766,Z86.74,Personal history of sudden cardiac arrest,429007001,History of cardiac arrest (situation)
767,M96.63,"Fracture of radius or ulna following insertion of orthopedic implant, joint prosthesis, or bone plate",65966004,Fracture of forearm (disorder)
768,S52,Fracture of forearm,65966004,Fracture of forearm (disorder)
769,R19.7,"Diarrhea, unspecified",236077008,Protracted diarrhea (finding)
770,A50.49,Other late congenital neurosyphilis,128188000,Cerebral palsy (disorder)
771,G80,Cerebral palsy,128188000,Cerebral palsy (disorder)
772,Z82.0,Family history of epilepsy and other diseases of the nervous system,128188000,Cerebral palsy (disorder)
773,G40.91,"Epilepsy, unspecified, intractable",128613002,Seizure disorder (disorder)
774,G40.30,"Generalized idiopathic epilepsy and epileptic syndromes, not intractable",128613002,Seizure disorder (disorder)
775,G40.89,Other seizures,128613002,Seizure disorder (disorder)
776,R56.9,Unspecified convulsions,128613002,Seizure disorder (disorder)
777,Z91.89,"Other specified personal risk factors, not elsewhere classified",128613002,Seizure disorder (disorder)
778,P90,Convulsions of newborn,128613002,Seizure disorder (disorder)
779,G40.90,"Epilepsy, unspecified, not intractable",128613002,Seizure disorder (disorder)
780,I45.5,Other specified heart block,128613002,Seizure disorder (disorder)
780,F79,Unspecified intellectual disabilities,128613002,Seizure disorder (disorder)
780,R56.00,Simple febrile convulsions,128613002,Seizure disorder (disorder)
780,H18.60,"Keratoconus, unspecified",128613002,Seizure disorder (disorder)
781,X78.9,Intentional self-harm by unspecified sharp object,287185009,Attempted suicide - cut/stab (event)
782,A41.01,Sepsis due to Methicillin susceptible Staphylococcus aureus,448417001,Sepsis caused by Staphylococcus aureus (disorder)
783,A41.0,Sepsis due to Staphylococcus aureus,448417001,Sepsis caused by Staphylococcus aureus (disorder)
784,M35.81,Multisystem inflammatory syndrome,840539006,Disease caused by Severe acute respiratory syndrome coronavirus 2 (disorder)
785,U07.1,COVID-19,840539006,Disease caused by Severe acute respiratory syndrome coronavirus 2 (disorder)
786,D89.83,Cytokine release syndrome,840539006,Disease caused by Severe acute respiratory syndrome coronavirus 2 (disorder)
787,E11.31,Type 2 diabetes mellitus with unspecified diabetic retinopathy,97331000119101,Macular edema and retinopathy due to type 2 diabetes mellitus (disorder)
788,E11.33,Type 2 diabetes mellitus with moderate nonproliferative diabetic retinopathy,97331000119101,Macular edema and retinopathy due to type 2 diabetes mellitus (disorder)
789,E11.32,Type 2 diabetes mellitus with mild nonproliferative diabetic retinopathy,97331000119101,Macular edema and retinopathy due to type 2 diabetes mellitus (disorder)
790,E11.34,Type 2 diabetes mellitus with severe nonproliferative diabetic retinopathy,97331000119101,Macular edema and retinopathy due to type 2 diabetes mellitus (disorder)
791,E11.35,Type 2 diabetes mellitus with proliferative diabetic retinopathy,97331000119101,Macular edema and retinopathy due to type 2 diabetes mellitus (disorder)
791,E11.65,Type 2 diabetes mellitus with hyperglycemia,97331000119101,Macular edema and retinopathy due to type 2 diabetes mellitus (disorder)
792,O03.89,Complete or unspecified spontaneous abortion with other complications,156073000,Complete miscarriage (disorder)
793,O03.80,Unspecified complication following complete or unspecified spontaneous abortion,156073000,Complete miscarriage (disorder)
794,O03.9,Complete or unspecified spontaneous abortion without complication,156073000,Complete miscarriage (disorder)
795,Z89.12,Acquired absence of wrist,698423002,History of disarticulation at wrist (situation)
796,Z86.69,Personal history of other diseases of the nervous system and sense organs,703151001,History of single seizure (situation)
797,H11.89,Other specified disorders of conjunctiva,246677007,Passive conjunctival congestion (finding)
798,G95.9,"Disease of spinal cord, unspecified",698754002,Chronic paralysis due to lesion of spinal cord
799,G83.9,"Paralytic syndrome, unspecified",698754002,Chronic paralysis due to lesion of spinal cord
800,Z20.82,Contact with and (suspected) exposure to other viral communicable diseases,840544004,Suspected disease caused by Severe acute respiratory coronavirus 2 (situation)
801,J01.90,"Acute sinusitis, unspecified",444814009,Viral sinusitis (disorder)
802,B97.89,Other viral agents as the cause of diseases classified elsewhere,444814009,Viral sinusitis (disorder)
802,J32.9,"Chronic sinusitis, unspecified",444814009,Viral sinusitis (disorder)
803,C34.92,Malignant neoplasm of unspecified part of left bronchus or lung,425048006,"Non-small cell carcinoma of lung, TNM stage 2 (disorder)"
804,C34.91,Malignant neoplasm of unspecified part of right bronchus or lung,425048006,"Non-small cell carcinoma of lung, TNM stage 2 (disorder)"
805,C34.90,Malignant neoplasm of unspecified part of unspecified bronchus or lung,425048006,"Non-small cell carcinoma of lung, TNM stage 2 (disorder)"
806,E11.65,Type 2 diabetes mellitus with hyperglycemia,80394007,Hyperglycemia (disorder)
807,E10.65,Type 1 diabetes mellitus with hyperglycemia,80394007,Hyperglycemia (disorder)
808,E13.65,Other specified diabetes mellitus with hyperglycemia,80394007,Hyperglycemia (disorder)
809,R73,Elevated blood glucose level,80394007,Hyperglycemia (disorder)
810,E11.01,Type 2 diabetes mellitus with hyperosmolarity with coma,80394007,Hyperglycemia (disorder)
811,R19.7,"Diarrhea, unspecified",267060006,Diarrhea symptom (finding)
812,J30.89,Other allergic rhinitis,446096008,Perennial allergic rhinitis (disorder)
813,T50.91,"Poisoning by, adverse effect of and underdosing of multiple unspecified drugs, medicaments and biological substances",55680006,Drug overdose (disorder)
814,T46.0,"Poisoning by, adverse effect of and underdosing of cardiac-stimulant glycosides and drugs of similar action",55680006,Drug overdose (disorder)
815,T45.0,"Poisoning by, adverse effect of and underdosing of antiallergic and antiemetic drugs",55680006,Drug overdose (disorder)
816,T50.90,"Poisoning by, adverse effect of and underdosing of unspecified drugs, medicaments and biological substances",55680006,Drug overdose (disorder)
817,T45.51,"Poisoning by, adverse effect of and underdosing of anticoagulants",55680006,Drug overdose (disorder)
818,R11.10,"Vomiting, unspecified",249497008,Vomiting symptom (finding)
819,M17,Osteoarthritis of knee,239873007,Osteoarthritis of knee (disorder)
820,R09.81,Nasal congestion,68235000,Nasal congestion (finding)
821,P28.89,Other specified respiratory conditions of newborn,68235000,Nasal congestion (finding)
822,J34.89,Other specified disorders of nose and nasal sinuses,68235000,Nasal congestion (finding)
823,R11.0,Nausea,422587007,Nausea (finding)
824,T31.95,Burns involving 90% or more of body surface with 50-59% third degree burns,403192003,Full thickness burn (disorder)
825,T31.93,Burns involving 90% or more of body surface with 30-39% third degree burns,403192003,Full thickness burn (disorder)
826,T31.98,Burns involving 90% or more of body surface with 80-89% third degree burns,403192003,Full thickness burn (disorder)
827,T31.97,Burns involving 90% or more of body surface with 70-79% third degree burns,403192003,Full thickness burn (disorder)
828,T31.94,Burns involving 90% or more of body surface with 40-49% third degree burns,403192003,Full thickness burn (disorder)
829,T31.96,Burns involving 90% or more of body surface with 60-69% third degree burns,403192003,Full thickness burn (disorder)
830,T31.99,Burns involving 90% or more of body surface with 90% or more third degree burns,403192003,Full thickness burn (disorder)
831,T26.40,"Burn of unspecified eye and adnexa, part unspecified",403192003,Full thickness burn (disorder)
832,T26.41,"Burn of right eye and adnexa, part unspecified",403192003,Full thickness burn (disorder)
833,T31.11,Burns involving 10-19% of body surface with 10-19% third degree burns,403192003,Full thickness burn (disorder)
834,T21.36,Burn of third degree of male genital region,403192003,Full thickness burn (disorder)
835,T20.34,Burn of third degree of nose (septum),403192003,Full thickness burn (disorder)
836,T30.0,"Burn of unspecified body region, unspecified degree",403192003,Full thickness burn (disorder)
837,T31.40,Burns involving 40-49% of body surface with 0% to 9% third degree burns,403192003,Full thickness burn (disorder)
838,T31.50,Burns involving 50-59% of body surface with 0% to 9% third degree burns,403192003,Full thickness burn (disorder)
839,T31.10,Burns involving 10-19% of body surface with 0% to 9% third degree burns,403192003,Full thickness burn (disorder)
840,T31.60,Burns involving 60-69% of body surface with 0% to 9% third degree burns,403192003,Full thickness burn (disorder)
841,T31.80,Burns involving 80-89% of body surface with 0% to 9% third degree burns,403192003,Full thickness burn (disorder)
842,T31.30,Burns involving 30-39% of body surface with 0% to 9% third degree burns,403192003,Full thickness burn (disorder)
843,T31.92,Burns involving 90% or more of body surface with 20-29% third degree burns,403192003,Full thickness burn (disorder)
844,T31.3,Burns involving 30-39% of body surface,403192003,Full thickness burn (disorder)
845,T31.2,Burns involving 20-29% of body surface,403192003,Full thickness burn (disorder)
846,T31.70,Burns involving 70-79% of body surface with 0% to 9% third degree burns,403192003,Full thickness burn (disorder)
847,T31.90,Burns involving 90% or more of body surface with 0% to 9% third degree burns,403192003,Full thickness burn (disorder)
848,T32.11,Corrosions involving 10-19% of body surface with 10-19% third degree corrosion,403192003,Full thickness burn (disorder)
849,T32.0,Corrosions involving less than 10% of body surface,403192003,Full thickness burn (disorder)
850,T32.10,Corrosions involving 10-19% of body surface with 0% to 9% third degree corrosion,403192003,Full thickness burn (disorder)
851,T31.20,Burns involving 20-29% of body surface with 0% to 9% third degree burns,403192003,Full thickness burn (disorder)
852,T31.0,Burns involving less than 10% of body surface,403192003,Full thickness burn (disorder)
853,T24.39,"Burn of third degree of multiple sites of lower limb, except ankle and foot",403192003,Full thickness burn (disorder)
854,T30.4,"Corrosion of unspecified body region, unspecified degree",403192003,Full thickness burn (disorder)
855,T31.91,Burns involving 90% or more of body surface with 10-19% third degree burns,403192003,Full thickness burn (disorder)
856,T31.4,Burns involving 40-49% of body surface,403192003,Full thickness burn (disorder)
857,L08.9,"Local infection of the skin and subcutaneous tissue, unspecified",403192003,Full thickness burn (disorder)
857,T25.31,Burn of third degree of ankle,403192003,Full thickness burn (disorder)
858,T20.30,"Burn of third degree of head, face, and neck, unspecified site",403192003,Full thickness burn (disorder)
858,L08.9,"Local infection of the skin and subcutaneous tissue, unspecified",403192003,Full thickness burn (disorder)
859,T80.89,"Other complications following infusion, transfusion and therapeutic injection",27942005,Shock (disorder)
860,T68,Hypothermia,27942005,Shock (disorder)
861,R57.8,Other shock,27942005,Shock (disorder)
862,O08.3,Shock following ectopic and molar pregnancy,27942005,Shock (disorder)
863,T81.10,Postprocedural shock unspecified,27942005,Shock (disorder)
864,R57.0,Cardiogenic shock,27942005,Shock (disorder)
865,R57.9,"Shock, unspecified",27942005,Shock (disorder)
866,O03.31,Shock following incomplete spontaneous abortion,27942005,Shock (disorder)
867,O03.81,Shock following complete or unspecified spontaneous abortion,27942005,Shock (disorder)
868,R29.89,Other symptoms and signs involving the musculoskeletal system,84229001,Fatigue (finding)
869,T73.3,Exhaustion due to excessive exertion,84229001,Fatigue (finding)
870,R53.82,"Chronic fatigue, unspecified",84229001,Fatigue (finding)
871,T73.2,Exhaustion due to exposure,84229001,Fatigue (finding)
872,R53.83,Other fatigue,84229001,Fatigue (finding)
873,D64.9,"Anemia, unspecified",84229001,Fatigue (finding)
874,M40.10,"Other secondary kyphosis, site unspecified",414564002,Kyphosis deformity of spine (disorder)
875,M40.29,Other kyphosis,414564002,Kyphosis deformity of spine (disorder)
876,M40.2,Other and unspecified kyphosis,414564002,Kyphosis deformity of spine (disorder)
877,M40.20,Unspecified kyphosis,414564002,Kyphosis deformity of spine (disorder)
878,Q05.9,"Spina bifida, unspecified",171131006,Meningocele (disorder)
879,Q05.8,Sacral spina bifida without hydrocephalus,171131006,Meningocele (disorder)
880,Q01.9,"Encephalocele, unspecified",171131006,Meningocele (disorder)
881,R45.89,Other symptoms and signs involving emotional state,225444004,At risk for suicide (finding)
882,Z71.1,Person with feared health complaint in whom no diagnosis is made,225444004,At risk for suicide (finding)
883,Z91.89,"Other specified personal risk factors, not elsewhere classified",225444004,At risk for suicide (finding)
884,R45.85,Homicidal and suicidal ideations,225444004,At risk for suicide (finding)
885,M32.9,"Systemic lupus erythematosus, unspecified",200936003,Lupus erythematosus (disorder)
886,L93,Lupus erythematosus,200936003,Lupus erythematosus (disorder)
887,E11.35,Type 2 diabetes mellitus with proliferative diabetic retinopathy,1501000119109,Proliferative retinopathy due to type 2 diabetes mellitus (disorder)
888,E66.1,Drug-induced obesity,162864005,Body mass index 30+ - obesity (finding)
889,E66.01,Morbid (severe) obesity due to excess calories,162864005,Body mass index 30+ - obesity (finding)
890,E66.2,Morbid (severe) obesity with alveolar hypoventilation,162864005,Body mass index 30+ - obesity (finding)
891,Z68.34,"Body mass index [BMI] 34.0-34.9, adult",162864005,Body mass index 30+ - obesity (finding)
892,Z68.38,"Body mass index [BMI] 38.0-38.9, adult",162864005,Body mass index 30+ - obesity (finding)
893,Z68.36,"Body mass index [BMI] 36.0-36.9, adult",162864005,Body mass index 30+ - obesity (finding)
894,Z68.30,"Body mass index [BMI]30.0-30.9, adult",162864005,Body mass index 30+ - obesity (finding)
895,Z68.31,"Body mass index [BMI] 31.0-31.9, adult",162864005,Body mass index 30+ - obesity (finding)
896,Z68.39,"Body mass index [BMI] 39.0-39.9, adult",162864005,Body mass index 30+ - obesity (finding)
897,E66.9,"Obesity, unspecified",162864005,Body mass index 30+ - obesity (finding)
898,Z68.32,"Body mass index [BMI] 32.0-32.9, adult",162864005,Body mass index 30+ - obesity (finding)
899,Z68.33,"Body mass index [BMI] 33.0-33.9, adult",162864005,Body mass index 30+ - obesity (finding)
900,Z68.37,"Body mass index [BMI] 37.0-37.9, adult",162864005,Body mass index 30+ - obesity (finding)
901,Z68.35,"Body mass index [BMI] 35.0-35.9, adult",162864005,Body mass index 30+ - obesity (finding)
902,A41.52,Sepsis due to Pseudomonas,448813005,Sepsis caused by Pseudomonas (disorder)
903,D55,Anemia due to enzyme disorders,271737000,Anemia (disorder)
904,O99.01,Anemia complicating pregnancy,271737000,Anemia (disorder)
905,D64.8,Other specified anemias,271737000,Anemia (disorder)
906,D56.1,Beta thalassemia,271737000,Anemia (disorder)
907,D75.81,Myelofibrosis,271737000,Anemia (disorder)
908,D63.1,Anemia in chronic kidney disease,271737000,Anemia (disorder)
909,D69.6,"Thrombocytopenia, unspecified",271737000,Anemia (disorder)
910,D64.89,Other specified anemias,271737000,Anemia (disorder)
911,D64.9,"Anemia, unspecified",271737000,Anemia (disorder)
912,D46.4,"Refractory anemia, unspecified",271737000,Anemia (disorder)
913,J82.83,Eosinophilic asthma,195967001,Asthma (disorder)
914,J45,Asthma,195967001,Asthma (disorder)
915,J44.9,"Chronic obstructive pulmonary disease, unspecified",195967001,Asthma (disorder)
916,R73.03,Prediabetes,714628002,Prediabetes (finding)
917,I10,Essential (primary) hypertension,59621000,Essential hypertension (disorder)
918,O99.28,"Other endocrine, nutritional and metabolic diseases complicating pregnancy, childbirth and the puerperium",59621000,Essential hypertension (disorder)
918,E27.40,Unspecified adrenocortical insufficiency,59621000,Essential hypertension (disorder)
918,O16.9,"Unspecified maternal hypertension, unspecified trimester",59621000,Essential hypertension (disorder)
919,J32,Chronic sinusitis,40055000,Chronic sinusitis (disorder)
920,C34.90,Malignant neoplasm of unspecified part of unspecified bronchus or lung,67811000119102,"Primary small cell malignant neoplasm of lung, TNM stage 1 (disorder)"
921,R68.89,Other general symptoms and signs,53827007,Excessive salivation (disorder)
922,K11.7,Disturbances of salivary secretion,53827007,Excessive salivation (disorder)
923,K11.20,"Sialoadenitis, unspecified",53827007,Excessive salivation (disorder)
924,Q87.89,"Other specified congenital malformation syndromes, not elsewhere classified",398152000,Poor muscle tone (finding)
925,P94.2,Congenital hypotonia,398152000,Poor muscle tone (finding)
926,R29.89,Other symptoms and signs involving the musculoskeletal system,398152000,Poor muscle tone (finding)
927,M62.89,Other specified disorders of muscle,398152000,Poor muscle tone (finding)
928,E83.30,"Disorder of phosphorus metabolism, unspecified",398152000,Poor muscle tone (finding)
929,C78.5,Secondary malignant neoplasm of large intestine and rectum,94260004,Secondary malignant neoplasm of colon (disorder)
930,F79,Unspecified intellectual disabilities,110359009,Intellectual disability (disorder)
931,Q87.19,Other congenital malformation syndromes predominantly associated with short stature,110359009,Intellectual disability (disorder)
932,G31.84,"Mild cognitive impairment, so stated",110359009,Intellectual disability (disorder)
933,F84.0,Autistic disorder,110359009,Intellectual disability (disorder)
934,Q87.89,"Other specified congenital malformation syndromes, not elsewhere classified",110359009,Intellectual disability (disorder)
935,F78,Other intellectual disabilities,110359009,Intellectual disability (disorder)
936,F72,Severe intellectual disabilities,110359009,Intellectual disability (disorder)
936,R62.50,Unspecified lack of expected normal physiological development in childhood,110359009,Intellectual disability (disorder)
936,Q21.3,Tetralogy of Fallot,110359009,Intellectual disability (disorder)
937,O09.40,"Supervision of pregnancy with grand multiparity, unspecified trimester",72892002,Normal pregnancy (finding)
938,Z33.1,"Pregnant state, incidental",72892002,Normal pregnancy (finding)
939,Z03.71,Encounter for suspected problem with amniotic cavity and membrane ruled out,72892002,Normal pregnancy (finding)
940,Z32.01,"Encounter for pregnancy test, result positive",72892002,Normal pregnancy (finding)
941,Z34,Encounter for supervision of normal pregnancy,72892002,Normal pregnancy (finding)
942,J01.90,"Acute sinusitis, unspecified",36971009,Sinusitis (disorder)
943,J30.9,"Allergic rhinitis, unspecified",36971009,Sinusitis (disorder)
944,J32.9,"Chronic sinusitis, unspecified",36971009,Sinusitis (disorder)
945,J11.1,Influenza due to unidentified influenza virus with other respiratory manifestations,36971009,Sinusitis (disorder)
946,I25.11,Atherosclerotic heart disease of native coronary artery with angina pectoris,53741008,Coronary arteriosclerosis (disorder)
947,I25.75,Atherosclerosis of native coronary artery of transplanted heart with angina pectoris,53741008,Coronary arteriosclerosis (disorder)
948,Q24.5,Malformation of coronary vessels,53741008,Coronary arteriosclerosis (disorder)
949,I25.81,Atherosclerosis of other coronary vessels without angina pectoris,53741008,Coronary arteriosclerosis (disorder)
950,I51.5,Myocardial degeneration,53741008,Coronary arteriosclerosis (disorder)
951,I25.10,Atherosclerotic heart disease of native coronary artery without angina pectoris,53741008,Coronary arteriosclerosis (disorder)
952,I25.83,Coronary atherosclerosis due to lipid rich plaque,53741008,Coronary arteriosclerosis (disorder)
